{"schema_version":"0.1","adapter_run_id":"ADAPTER-JD-CN-COFFEE","adapter":{"adapter_id":"authenticated-browser-jd","adapter_version":"0.1-candidate","adapter_family":"AUTHENTICATED_BROWSER","platform_codes":["JD-CN"]},"source":{"platform_code":"JD-CN","platform_name":"JD China","access_method":"BROWSER","market_country":"CN","source_url":"https://item.jd.com/10125691765315.html","observed_at":"2026-08-25T08:00:00Z","authentication_used":true},"execution_status":"PARTIAL","input_records":[{"input_id":"IN-JD-CAPTURE","record_type":"BROWSER_CAPTURE","raw_reference":"browser-capture:JD-CN-MIAOQUE-redacted","content_hash":null,"redacted":true,"observed_at":"2026-08-25T08:00:00Z"}],"output_artifacts":[{"artifact_type":"EVIDENCE_ONLY","artifact_id":"JD-CN-MIAOQUE-EVIDENCE","schema_version":"0.1","artifact_path":"cases/coffee-beverage-machine-munich-2026/procurement-output-v0.1-final-candidate.json","validation_status":"NOT_RUN"}],"field_mappings":[{"mapping_id":"MAP-JD-DISPLAY-PRICE","input_id":"IN-JD-CAPTURE","source_path":"/visible/price","target_artifact_id":"JD-CN-MIAOQUE-EVIDENCE","target_path":"/main_comparison_table/JD-CN-MIAOQUE/display_price","transformation":"MANUAL_INTERPRETATION","value_status":"OBSERVED","confidence":"LOW","evidence_ref":"browser-capture:JD-CN-MIAOQUE-redacted"}],"unmapped_fields":[{"input_id":"IN-JD-CAPTURE","source_path":"/session/cookies","reason":"登录凭据属于敏感信息，不得进入产物","disposition":"SENSITIVE_REDACTED"},{"input_id":"IN-JD-CAPTURE","source_path":"/visible/sku","reason":"未锁定具体SKU","disposition":"NEEDS_MAPPING"}],"warnings":["仅形成证据记录，具体SKU和详情仍待刷新"],"errors":[],"provenance":{"started_at":"2026-08-25T08:00:00Z","finished_at":"2026-08-25T08:05:00Z","created_by":"Procurement-price-comparison Agent","collection_run_id":null,"overall_confidence":"LOW","assumptions":["浏览器会话信息已脱敏且不写入仓库"]}}

