{"schema_version":"0.1","adapter_run_id":"ADAPTER-TAOBAO-SPEAKER","adapter":{"adapter_id":"taobao-apify","adapter_version":"0.1-candidate","adapter_family":"APIFY_MARKETPLACE","platform_codes":["TAOBAO-CN"]},"source":{"platform_code":"TAOBAO-CN","platform_name":"Taobao","access_method":"API","market_country":"CN","source_url":"https://item.taobao.com/item.htm?id=726948050702","observed_at":"2026-08-26T02:25:00Z","authentication_used":false},"execution_status":"SUCCEEDED","input_records":[{"input_id":"IN-TB-SEARCH","record_type":"SEARCH_RESULT","raw_reference":"apify-dataset:taobao-search-redacted","content_hash":null,"redacted":true,"observed_at":"2026-08-26T02:19:24Z"},{"input_id":"IN-TB-DETAIL","record_type":"PRODUCT_DETAIL","raw_reference":"apify-dataset:taobao-detail-redacted","content_hash":null,"redacted":true,"observed_at":"2026-08-26T02:25:00Z"}],"output_artifacts":[{"artifact_type":"PRODUCT_CANDIDATE","artifact_id":"TAOBAO-726948050702-BLUE-QTY10","schema_version":"0.1","artifact_path":"cases/bluetooth-speaker-giveaway/product-candidate-taobao-726948050702-real-regression.json","validation_status":"PASSED"},{"artifact_type":"SUPPLIER","artifact_id":"SUP-TAOBAO-2215377569695","schema_version":"0.1","artifact_path":"cases/bluetooth-speaker-giveaway/supplier-taobao-2215377569695-real-regression.json","validation_status":"PASSED"}],"field_mappings":[{"mapping_id":"MAP-TB-PRICE","input_id":"IN-TB-DETAIL","source_path":"/sku/5266969924720/price","target_artifact_id":"TAOBAO-726948050702-BLUE-QTY10","target_path":"/offer/selected_sku_price","transformation":"NORMALIZED","value_status":"OBSERVED","confidence":"HIGH","evidence_ref":"EV-TB-DETAIL-726948050702"},{"mapping_id":"MAP-TB-RATING","input_id":"IN-TB-SEARCH","source_path":"/seller/goodRate","target_artifact_id":"SUP-TAOBAO-2215377569695","target_path":"/platform_profiles/0/ratings/0","transformation":"NORMALIZED","value_status":"OBSERVED","confidence":"MEDIUM","evidence_ref":"EV-SUP-TB-SPEAKER"}],"unmapped_fields":[],"warnings":[],"errors":[],"provenance":{"started_at":"2026-08-26T02:19:24Z","finished_at":"2026-08-26T02:30:00Z","created_by":"Procurement-price-comparison Agent","collection_run_id":"redacted","overall_confidence":"MEDIUM","assumptions":["社区Actor字段已按目标Schema归一化"]}}

