{"schema_version":"0.1","adapter_run_id":"ADAPTER-GGM-HAS2S","adapter":{"adapter_id":"public-web-product","adapter_version":"0.1-candidate","adapter_family":"PUBLIC_WEB","platform_codes":["GGM-DE"]},"source":{"platform_code":"GGM-DE","platform_name":"GGM Gastro Germany","access_method":"PUBLIC_WEB","market_country":"DE","source_url":"https://www.ggmgastro.com/de-de-eur/heissgetraenkeautomat-2-programme-digital-2-pulverbehaelter-schwarz-has2s","observed_at":"2026-08-25T10:20:00Z","authentication_used":false},"execution_status":"SUCCEEDED","input_records":[{"input_id":"IN-GGM-PAGE","record_type":"WEB_PAGE","raw_reference":"web-page:GGM-HAS2S","content_hash":null,"redacted":false,"observed_at":"2026-08-25T10:20:00Z"}],"output_artifacts":[{"artifact_type":"PRODUCT_CANDIDATE","artifact_id":"GGM-HAS2S-DE-MUNICH-2026","schema_version":"0.1","artifact_path":"examples/product-candidate.equipment.coffee-machine.example.json","validation_status":"PASSED"},{"artifact_type":"SUPPLIER","artifact_id":"SUPPLIER-GGM-GASTRO","schema_version":"0.1","artifact_path":"cases/coffee-beverage-machine-munich-2026/supplier-ggm-gastro-lightweight-real-regression.json","validation_status":"PASSED"}],"field_mappings":[{"mapping_id":"MAP-GGM-PRICE","input_id":"IN-GGM-PAGE","source_path":"/page/price","target_artifact_id":"GGM-HAS2S-DE-MUNICH-2026","target_path":"/offer/selected_sku_price","transformation":"NORMALIZED","value_status":"OBSERVED","confidence":"HIGH","evidence_ref":"EV-GGM-HAS2S-PAGE"},{"mapping_id":"MAP-GGM-POWER","input_id":"IN-GGM-PAGE","source_path":"/page/specifications/power","target_artifact_id":"GGM-HAS2S-DE-MUNICH-2026","target_path":"/category_data/power","transformation":"DIRECT","value_status":"OBSERVED","confidence":"HIGH","evidence_ref":"EV-GGM-HAS2S-PAGE"}],"unmapped_fields":[],"warnings":["2026年11月库存需下单前刷新"],"errors":[],"provenance":{"started_at":"2026-08-25T10:20:00Z","finished_at":"2026-08-25T10:21:00Z","created_by":"Procurement-price-comparison Agent","collection_run_id":null,"overall_confidence":"MEDIUM","assumptions":["公开网页内容不等于正式报价"]}}

