{"schema_version":"0.1","adapter_run_id":"ADAPTER-1688-MASCOT","adapter":{"adapter_id":"1688-apify","adapter_version":"0.1-candidate","adapter_family":"APIFY_MARKETPLACE","platform_codes":["1688-CN"]},"source":{"platform_code":"1688-CN","platform_name":"1688","access_method":"API","market_country":"CN","source_url":"https://detail.1688.com/offer/817907206474.html","observed_at":"2026-08-26T03:05:00Z","authentication_used":false},"execution_status":"PARTIAL","input_records":[{"input_id":"IN-1688-DETAIL","record_type":"PRODUCT_DETAIL","raw_reference":"apify-dataset:1688-detail-redacted","content_hash":null,"redacted":true,"observed_at":"2026-08-26T03:05:00Z"}],"output_artifacts":[{"artifact_type":"PRODUCT_CANDIDATE","artifact_id":"1688-817907206474-MASCOT","schema_version":"0.1","artifact_path":"cases/ip-mascot-costume/product-candidate-1688-817907206474-real-regression.json","validation_status":"PASSED"},{"artifact_type":"SUPPLIER","artifact_id":"SUP-1688-2218283287713F8E88","schema_version":"0.1","artifact_path":"cases/ip-mascot-costume/supplier-1688-2218283287713f8e88-real-regression.json","validation_status":"PASSED"}],"field_mappings":[{"mapping_id":"MAP-1688-START-PRICE","input_id":"IN-1688-DETAIL","source_path":"/priceRange/0","target_artifact_id":"1688-817907206474-MASCOT","target_path":"/offer/search_display_price","transformation":"NORMALIZED","value_status":"OBSERVED","confidence":"LOW","evidence_ref":"EV-MASCOT-1688-DETAIL"},{"mapping_id":"MAP-1688-CAPABILITY","input_id":"IN-1688-DETAIL","source_path":"/title","target_artifact_id":"SUP-1688-2218283287713F8E88","target_path":"/capabilities/items/0","transformation":"MANUAL_INTERPRETATION","value_status":"DERIVED","confidence":"MEDIUM","evidence_ref":"EV-SUP-1688-MASCOT"}],"unmapped_fields":[{"input_id":"IN-1688-DETAIL","source_path":"/priceRange/0","reason":"无法证明是锁定IP设计后的完整定制价","disposition":"PRESERVED_RAW"}],"warnings":["页面起始价仅映射为搜索展示价","完整材料、重量和10天交期仍未知"],"errors":[],"provenance":{"started_at":"2026-08-26T03:00:00Z","finished_at":"2026-08-26T03:10:00Z","created_by":"Procurement-price-comparison Agent","collection_run_id":"redacted","overall_confidence":"LOW","assumptions":["未询盘"]}}

